Pina Colada|A sweet cocktail made with rum, coconut cream or coconut milk, and pineapple juice|2.4|300
Manhattan|Made with whiskey, sweet vermouth, and bitters. |3.2|250
Black Russian|Cocktail of vodka and coffee liqueur, also known as a "Black Ewan". |2.1|150
Cosmopolitan|Cocktail made with vodka, triple sec, cranberry juice, and freshly squeezed or sweetened lime juice.|1.7|200
Rose|An IBA official cocktail made of vermouth, cherry eau de vie and fruit syrup.|1.9|180
Mojito|A traditional Cuban highball. Traditionally, a mojito is a cocktail that consists of five ingredients: white rum, sugar, lime juice, soda water, and mint.|3|200
Screwdriver|A popular alcoholic highball drink made with orange juice and vodka.|3.2|220
Salty Dog|A cocktail of tequila, or gin, and grapefruit juice, served in a highball glass with a salted rim.|2.2|100
Cuba Libre|A caffeinated alcoholic cocktail made of cola, lime, and dark or light rum. |1.8|200
